Name,Gender,Rating Value,Rating Count,Main Accords,Perfumers,Description
Cool Water Street Fighter Champion Summer Edition For Him Davidofffor men,for men,3.87,129,"['citrus', 'fresh spicy', 'woody', 'warm spicy']",['Jérôme di Marino'],Cool Water Street Fighter Champion Summer Edition For HimbyDavidoffis a Woody Aromatic fragrance for men.Cool Water Street Fighter Champion Summer Edition For Himwas launched in 2021. The nose behind this fragrance is Jérôme di Marino. Top note is Mandarin Orange; middle note is Pepper; base note is Guaiac Wood.
Cool Water Woman Freeze Me Davidofffor women,for women,3.84,67,"['white floral', 'fruity', 'powdery', 'fresh', 'floral', 'sweet', 'woody', 'violet', 'tropical', 'iris']",['Pierre Bourdon'],"Cool Water Woman Freeze MebyDavidoffis a Floral Fruity fragrance for women.Cool Water Woman Freeze Mewas launched in 2008. The nose behind this fragrance is Pierre Bourdon. Top note is Pineapple; middle notes are Lily-of-the-Valley, Violet, Magnolia, Bamboo and Jasmine; base notes are Peach, Orris Root, Musk, Sandalwood and Amber."
Cool Water Game Davidofffor women,for women,3.72,419,"['fruity', 'floral', 'fresh', 'citrus', 'woody', 'aquatic', 'sweet', 'powdery', 'musky', 'green']",['Beatrice Piquet'],"Cool Water GamebyDavidoffis a Floral Fruity fragrance for women.Cool Water Gamewas launched in 2006. The nose behind this fragrance is Beatrice Piquet. Top notes are Apple and Lemon; middle notes are Exotic Fruits, Water Lily and Freesia; base notes are Musk, Cedar and Sandalwood."
Cool Water Game for Him Davidofffor men,for men,4.01,372,"['ozonic', 'aquatic', 'citrus', 'fresh spicy', 'aromatic', 'fruity', 'woody', 'green', 'lavender', 'patchouli']",['Pierre Wargnye'],"Cool Water Game for HimbyDavidoffis a Aromatic Aquatic fragrance for men.Cool Water Game for Himwas launched in 2006. The nose behind this fragrance is Pierre Wargnye. Top notes are Watermelon, Grapefruit, Lemon Verbena and Basil; middle notes are Lavender, Violet Leaf and Black Currant; base notes are Patchouli and Woodsy Notes."
Cool Water Sea Rose Davidofffor women,for women,3.85,842,"['floral', 'fresh', 'musky', 'rose', 'fruity', 'sweet', 'powdery']",['Aurélien Guichard'],Cool Water Sea RosebyDavidoffis a Floral fragrance for women.Cool Water Sea Rosewas launched in 2013. The nose behind this fragrance is Aurélien Guichard. Top note is Pear; middle note is Pink Peony; base note is Musk.
Cool Water Wave Davidofffor women,for women,3.51,599,"['floral', 'fruity', 'tropical', 'fresh', 'musky', 'ozonic', 'aquatic', 'sweet', 'powdery', 'soft spicy']",['Philippe Bousseton'],"Cool Water WavebyDavidoffis a Floral Fruity fragrance for women.Cool Water Wavewas launched in 2007. The nose behind this fragrance is Philippe Bousseton. Top notes are Watermelon, Guava, Passionfruit and Mango; middle notes are Pink Pepper, Peony and Freesia; base notes are Musk, Iris, Sandalwood and Amber."
Cool Water Woman Wave Davidofffor women,for women,3.78,181,"['floral', 'marine', 'citrus', 'tropical', 'aromatic', 'fruity', 'aquatic', 'woody', 'white floral', 'sweet']","['Francis Kurkdjian', 'Maïa Lernout']","Cool Water Woman WavebyDavidoffis a Floral Aquatic fragrance for women.Cool Water Woman Wavewas launched in 2018. Cool Water Woman Wave was created by Maïa Lernout and Francis Kurkdjian. Top notes are Frangipani, Pear and Lime; middle notes are Sea Notes, Jasmine Sambac and Floral Notes; base notes are Woody Notes and Amber."
Davidoff Cool Water Sea Rose Coral Reef Edition Davidofffor women,for women,3.65,65,"['rose', 'citrus', 'woody', 'musky', 'powdery', 'floral', 'amber']",['Aurélien Guichard'],Davidoff Cool Water Sea Rose Coral Reef EditionbyDavidoffis a Floral fragrance for women.Davidoff Cool Water Sea Rose Coral Reef Editionwas launched in 2014. The nose behind this fragrance is Aurélien Guichard. Top note is Mandarin Orange; middle note is Rose; base note is Cashmeran.
Davidoff Agar Blend Davidofffor women and men,for women and men,4.19,112,"['warm spicy', 'amber', 'oud', 'cinnamon', 'woody', 'fresh spicy']",['Alienor Massenet'],"Davidoff Agar BlendbyDavidoffis a Amber Woody fragrance for women and men.Davidoff Agar Blendwas launched in 2015. The nose behind this fragrance is Alienor Massenet. Top notes are Cinnamon, Black Pepper and Cloves; middle notes are Agarwood (Oud) and Guaiac Wood; base notes are Benzoin, Agarwood (Oud) and Amber."
Davidoff Amber Blend Davidofffor women and men,for women and men,4.46,213,"['amber', 'woody', 'warm spicy', 'balsamic', 'cinnamon', 'rum', 'fresh spicy', 'powdery']",['Olivier Pescheux'],Davidoff Amber BlendbyDavidoffis a Amber Spicy fragrance for women and men.Davidoff Amber Blendwas launched in 2016. The nose behind this fragrance is Olivier Pescheux. Top notes are Cinnamon and Nutmeg; middle notes are Amber and Rum; base notes are Peru Balsam and Sandalwood.
Davidoff Leather Blend Davidofffor women and men,for women and men,4.36,448,"['leather', 'amber', 'warm spicy', 'animalic', 'fresh spicy', 'woody', 'metallic', 'smoky', 'rose']",['Christophe Raynaud'],Davidoff Leather BlendbyDavidoffis a Leather fragrance for women and men.Davidoff Leather Blendwas launched in 2014. The nose behind this fragrance is Christophe Raynaud. Top notes are Saffron and Pepper; middle notes are Amber and Rose; base notes are Leather and Papyrus.
Wood Blend Davidofffor women and men,for women and men,4.22,98,"['aromatic', 'warm spicy', 'amber', 'leather', 'fresh spicy', 'woody', 'soft spicy', 'earthy', 'animalic', 'metallic']",['Julien Rasquinet'],"Wood BlendbyDavidoffis a Woody Spicy fragrance for women and men.Wood Blendwas launched in 2017. The nose behind this fragrance is Julien Rasquinet. Top notes are Cardamom, Nutmeg and Lemon; middle notes are Coriander, Saffron and Vetiver; base notes are Leather, Olibanum and Amber."
Cool Water Pacific Summer Edition for Men Davidofffor men,for men,4.02,59,"['aromatic', 'citrus', 'fresh spicy', 'green', 'woody', 'herbal']",['Philippe Bousseton'],"Cool Water Pacific Summer Edition for MenbyDavidoffis a Woody Aromatic fragrance for men.Cool Water Pacific Summer Edition for Menwas launched in 2017. The nose behind this fragrance is Philippe Bousseton. Top notes are Tangerine, Grapefruit and Lemon; middle notes are Mint, Basil and Sage; base notes are Juniper and Sandalwood."
Cool Water Pacific Summer Edition for Women Davidofffor women,for women,3.86,58,"['green', 'fresh', 'fruity', 'sweet', 'white floral', 'iris', 'ozonic', 'aromatic', 'aquatic', 'tropical']",['Pierre Bourdon'],"Cool Water Pacific Summer Edition for WomenbyDavidoffis a Aromatic Fruity fragrance for women.Cool Water Pacific Summer Edition for Womenwas launched in 2017. The nose behind this fragrance is Pierre Bourdon. Top notes are Melon, Pineapple and Mint; middle note is Lily-of-the-Valley; base note is Iris."
Cool Water Woman Sea Rose Pacific Summer Edition Davidofffor women,for women,4.12,40,"['woody', 'rose', 'fruity', 'citrus', 'sweet', 'musky', 'powdery', 'aquatic', 'floral', 'amber']",['Aurélien Guichard'],Cool Water Woman Sea Rose Pacific Summer EditionbyDavidoffis a Floral Fruity fragrance for women.Cool Water Woman Sea Rose Pacific Summer Editionwas launched in 2017. The nose behind this fragrance is Aurélien Guichard. Top notes are Pear and Tangerine; middle note is Rose; base notes are Cashmeran and Woody Notes.
Echo Woman Davidofffor women,for women,3.83,"1,525","['floral', 'fresh', 'powdery', 'violet', 'vodka', 'musky', 'rose', 'woody', 'iris', 'fruity']",['Francoise Caron'],"Echo WomanbyDavidoffis a Chypre Floral fragrance for women.Echo Womanwas launched in 2004. The nose behind this fragrance is Francoise Caron. Top notes are Vodka and White Musk; middle notes are Peony, Violet, Osmanthus and Iris; base notes are Woody Notes, Crystal Amber and Cinnamon."
Good Life Davidofffor men,for men,4.35,721,"['green', 'citrus', 'floral', 'fresh', 'aromatic', 'woody', 'fresh spicy', 'sweet', 'fruity', 'lavender']",['Pierre Bourdon'],"Good LifebyDavidoffis a Woody Floral Musk fragrance for men.Good Lifewas launched in 1998. The nose behind this fragrance is Pierre Bourdon. Top notes are Fig Leaf, Bergamot, Lavender, Melon and Grapefruit; middle notes are Tea, Magnolia, Violet, Black Currant, Pelargonium and Amalfi Lemon; base notes are Clover, Sandalwood, Almond and Amber."
Good Life Women Davidofffor women,for women,4.03,452,"['woody', 'sweet', 'fruity', 'floral', 'yellow floral', 'powdery', 'amber', 'iris', 'rose', 'warm spicy']",['Pierre Bourdon'],"Good Life WomenbyDavidoffis a Amber Vanilla fragrance for women.Good Life Womenwas launched in 1999. The nose behind this fragrance is Pierre Bourdon. Top notes are Fig, Rose and Jasmine; middle notes are Fig, Ylang-Ylang, Magnolia and Orris Root; base notes are Sandalwood, Amber, Pepper and Vetiver."
Horizon Davidofffor men,for men,3.85,520,"['woody', 'fresh spicy', 'aromatic', 'warm spicy', 'citrus', 'earthy', 'patchouli', 'cacao']","['Jacques Huclier', 'Olivier Pescheux']","HorizonbyDavidoffis a Woody Spicy fragrance for men.Horizonwas launched in 2016. Horizon was created by Olivier Pescheux and Jacques Huclier. Top notes are Ginger, Grapefruit, Rosemary and Mandarin Orange; middle notes are Cedar, Patchouli, Pepper, Nutmeg and Sesame; base notes are Vetiver and Cacao Pod."
Horizon Extreme Davidofffor men,for men,3.85,143,"['woody', 'fresh spicy', 'warm spicy', 'leather', 'aromatic', 'powdery', 'citrus', 'animalic', 'earthy', 'amber']","['Jacques Huclier', 'Olivier Pescheux']","Horizon ExtremebyDavidoffis a Amber Woody fragrance for men.Horizon Extremewas launched in 2017. Horizon Extreme was created by Olivier Pescheux and Jacques Huclier. Top notes are Ginger, Grapefruit and Rosemary; middle notes are Leather, Cypriol Oil or Nagarmotha, Cedar and Nutmeg; base notes are Sandalwood and Amber."
Run Wild Davidofffor men,for men,3.76,314,"['warm spicy', 'aromatic', 'fresh spicy', 'lavender', 'cinnamon', 'fresh', 'woody', 'vanilla', 'sweet', 'conifer']","['Alexandra Carlin', 'Pierre-Constantin Guéros']",Run WildbyDavidoffis a Aromatic Spicy fragrance for men.Run Wildwas launched in 2019. Run Wild was created by Alexandra Carlin and Pierre-Constantin Guéros. Top notes are Ginger and Cinnamon; middle note is Lavender; base notes are Fir Resin and Tonka Bean.
Run Wild for Her Davidofffor women,for women,3.82,245,"['white floral', 'woody']","['Alienor Massenet', 'Emilie Bevierre-Coppermann']",Run Wild for HerbyDavidoffis a Floral Fruity fragrance for women.Run Wild for Herwas launched in 2019. Run Wild for Her was created by Alienor Massenet and Emilie Bevierre-Coppermann. Top notes are Pomegranate and Pistachio; middle note is Jasmine; base note is Lily.
Silver Shadow Davidofffor men,for men,4.01,743,"['warm spicy', 'amber', 'citrus', 'woody', 'cinnamon', 'aromatic', 'earthy']",['Calice Becker'],"Silver ShadowbyDavidoffis a Amber Woody fragrance for men.Silver Shadowwas launched in 2005. The nose behind this fragrance is Calice Becker. Top notes are Bitter Orange, Coriander and Virginia Cedar; middle notes are Saffron, Clove and Patchouli; base notes are Benzoin, Amber, Cinnamon and oak moss."
Silver Shadow Altitude Davidofffor men,for men,4.24,558,"['aromatic', 'fresh spicy', 'woody', 'citrus', 'warm spicy', 'musky', 'amber']",['Jean Jacques'],"Silver Shadow AltitudebyDavidoffis a Woody Aromatic fragrance for men.Silver Shadow Altitudewas launched in 2007. The nose behind this fragrance is Jean Jacques. Top notes are Grapefruit and Juniper Berries; middle notes are Cedar, Cardamom, Caraway and Celery; base notes are Cashmere Wood, Incense and Musk."
The Brilliant Game Davidofffor men,for men,3.96,313,"['sweet', 'aromatic', 'fruity', 'vanilla', 'citrus', 'caramel', 'woody', 'amber', 'fresh', 'balsamic']",['Jacques Huclier'],"The Brilliant GamebyDavidoffis a Amber Woody fragrance for men.The Brilliant Gamewas launched in 2014. The nose behind this fragrance is Jacques Huclier. Top notes are Campari, Red Berries, Vermouth, Bitter Orange, Lemon and Clary Sage; middle notes are Cedar and Orange Blossom; base notes are Tonka Bean, Caramel, Coumarin and Hay."
The Game Intense Davidofffor men,for men,3.88,179,"['woody', 'earthy', 'patchouli', 'amber', 'aromatic', 'iris']",['Lucas Sieuzac'],The Game IntensebyDavidoffis a Amber Woody fragrance for men.The Game Intensewas launched in 2013. The nose behind this fragrance is Lucas Sieuzac. Top note is Gin; middle notes are Blackwood and Orris; base notes are Patchouli and Labdanum.
Earl Grey Tea Demeter Fragrancefor women and men,for women and men,3.67,162,"['citrus', 'fresh spicy', 'green', 'aromatic', 'fresh']",['Christopher Brosius'],Earl Grey TeabyDemeter Fragranceis a Citrus Aromatic fragrance for women and men.Earl Grey Teawas launched in 1996. The nose behind this fragrance is Christopher Brosius.
Moscow Mule Demeter Fragrancefor women and men,for women and men,2.33,6,"['vodka', 'citrus', 'warm spicy', 'conifer', 'fresh']",['Angeline Poubeau Leporini'],Moscow MulebyDemeter Fragranceis a fragrance for women and men.Moscow Mulewas launched in 2021. The nose behind this fragrance is Angeline Poubeau Leporini.
Apple Pie Demeter Fragrancefor women and men,for women and men,3.75,85,"['fruity', 'cinnamon', 'sweet', 'warm spicy', 'fresh', 'green', 'fresh spicy', 'vanilla', 'nutty']",['Christopher Brosius'],Apple PiebyDemeter Fragranceis a Amber Vanilla fragrance for women and men.Apple Piewas launched in 2003. The nose behind this fragrance is Christopher Brosius.
Christmas Tree Demeter Fragrancefor women and men,for women and men,3.84,102,"['fresh spicy', 'aromatic', 'woody', 'fresh', 'conifer', 'green', 'citrus', 'warm spicy', 'sweet', 'balsamic']",['Christopher Brosius'],Christmas TreebyDemeter Fragranceis a Citrus Aromatic fragrance for women and men. The nose behind this fragrance is Christopher Brosius.
Cosmopolitan Cocktail Demeter Fragrancefor women,for women,3.59,32,"['vodka', 'fruity', 'citrus', 'fresh spicy', 'sour']",['Christopher Brosius'],Cosmopolitan CocktailbyDemeter Fragranceis a Chypre Floral fragrance for women.Cosmopolitan Cocktailwas launched in 2004. The nose behind this fragrance is Christopher Brosius.
Green Tomato Demeter Fragrancefor women and men,for women and men,4.09,11,['green'],['Christopher Brosius'],Green TomatobyDemeter Fragranceis a Aromatic Fougere fragrance for women and men. The nose behind this fragrance is Christopher Brosius.
Honeysuckle Demeter Fragrancefor women,for women,4.02,244,"['white floral', 'fruity', 'yellow floral']",['Christopher Brosius'],HoneysucklebyDemeter Fragranceis a Floral fragrance for women.Honeysucklewas launched in 1998. The nose behind this fragrance is Christopher Brosius.
Pruning Shears Demeter Fragrancefor women and men,for women and men,3.8,40,"['rose', 'green', 'metallic', 'fresh', 'mineral', 'floral']",['Francis Kurkdjian'],Pruning ShearsbyDemeter Fragranceis a Floral Green fragrance for women and men.Pruning Shearswas launched in 1998. The nose behind this fragrance is Francis Kurkdjian.
Tomato Demeter Fragrancefor women and men,for women and men,4.07,261,"['aromatic', 'green', 'fresh spicy']",['Christopher Brosius'],TomatobyDemeter Fragranceis a Aromatic Fougere fragrance for women and men.Tomatowas launched in 1996. The nose behind this fragrance is Christopher Brosius.
Bonne Étoile Baby Dior Diorfor women and men,for women and men,3.18,28,"['musky', 'powdery']",['Francis Kurkdjian'],Bonne Étoile Baby DiorbyDioris a Floral Fruity fragrance for women and men. This is a new fragrance.Bonne Étoile Baby Diorwas launched in 2023. The nose behind this fragrance is Francis Kurkdjian. Top note is Green Pear; middle note is Wild Rose; base note is White Musk.
Dior Dior Diorfor women,for women,4.34,214,"['white floral', 'fresh', 'woody', 'green', 'floral', 'mossy', 'aldehydic', 'yellow floral', 'earthy', 'amber']",['Edmond Roudnitska'],"Dior DiorbyDioris a Chypre Floral fragrance for women.Dior Diorwas launched in 1976. The nose behind this fragrance is Edmond Roudnitska. Top notes are Aldehydes, Lilac and Jasmine; middle notes are Narcissus and Lily-of-the-Valley; base notes are oak moss, Woodsy Notes and Amber."
Dior Star Diorfor women,for women,3.87,314,"['citrus', 'floral', 'white floral', 'fruity', 'fresh', 'fresh spicy', 'aromatic', 'rose', 'green', 'almond']",['Beatrice Piquet'],"Dior StarbyDioris a Floral Fruity fragrance for women.Dior Starwas launched in 2005. The nose behind this fragrance is Beatrice Piquet. Top notes are Bergamot, Petitgrain and Mandarin Orange; middle notes are Peony and Honeysuckle; base notes are Almond and Musk."
Diorama Diorfor women,for women,4.33,211,"['white floral', 'woody', 'fruity', 'animalic', 'fresh spicy', 'musky', 'powdery', 'leather', 'warm spicy', 'earthy']",['Edmond Roudnitska'],"DioramabyDioris a Chypre Fruity fragrance for women.Dioramawas launched in 1948. The nose behind this fragrance is Edmond Roudnitska. Top notes are Plum, Peach, Melon and Bergamot; middle notes are Jasmine, Gardenia, Tuberose, Rose, Cinnamon, Violet, Caraway, Pepper, Nutmeg, Lily-of-the-Valley and Clove; base notes are oak moss, Castoreum, Civetta, Leather, Vetiver, Sandalwood, Musk and Virginia Cedar."
Diorella Diorfor women,for women,4.2,"1,584","['citrus', 'green', 'aromatic', 'white floral', 'earthy', 'mossy', 'fresh spicy', 'fruity', 'woody', 'floral']",['Edmond Roudnitska'],"DiorellabyDioris a Chypre Floral fragrance for women.Diorellawas launched in 1972. The nose behind this fragrance is Edmond Roudnitska. Top notes are Green Notes, Sicilian Lemon, Bergamot, Melon and Basil; middle notes are Honeysuckle, Moroccan Jasmine, Peach, Carnation, Cyclamen and Rose; base notes are Oakmoss, Vetiver, Patchouli and Musk."
Diorella Parfum Diorfor women,for women,4.53,131,"['citrus', 'white floral', 'fruity', 'earthy', 'woody', 'green', 'aromatic', 'mossy', 'fresh', 'floral']",['Edmond Roudnitska'],"Diorella ParfumbyDioris a Floral Fruity fragrance for women.Diorella Parfumwas launched in 1972. The nose behind this fragrance is Edmond Roudnitska. Top notes are Bergamot, Green Notes, Melon and Lemon; middle notes are Honeysuckle, Peach, Jasmine, Rose and Cyclamen; base notes are Oakmoss, Vetiver, Patchouli and Musk."
Diorissimo Diorfor women,for women,4.14,"4,611","['white floral', 'green', 'fresh', 'floral']",['Edmond Roudnitska'],"DiorissimobyDioris a Floral fragrance for women.Diorissimowas launched in 1956. The nose behind this fragrance is Edmond Roudnitska. Top notes are Green Leaves and Bergamot; middle notes are Lily-of-the-Valley, Lilac, Jasmine, Lily, Ylang-Ylang, Amaryllis, Rosemary and Boronia; base notes are Civet and Sandalwood."
Diorissimo (2024) Diorfor women,for women,3.29,7,"['white floral', 'fresh', 'green']",['Francis Kurkdjian'],Diorissimo (2024)byDioris a Floral fragrance for women. This is a new fragrance.Diorissimo (2024)was launched in 2024. The nose behind this fragrance is Francis Kurkdjian.
Diorling Diorfor women,for women,4.43,178,"['earthy', 'floral', 'woody', 'green', 'leather', 'white floral', 'rose', 'mossy', 'fresh spicy', 'powdery']",['Paul Vacher'],"DiorlingbyDioris a Chypre fragrance for women.Diorlingwas launched in 1963. The nose behind this fragrance is Paul Vacher. Top notes are Hyacinth and Bergamot; middle notes are Rose, Iris, Jasmine and Lily-of-the-Valley; base notes are Leather, oak moss, Vetiver, Musk and Patchouli."
Dolce Vita Diorfor women,for women,4.05,"10,145","['warm spicy', 'woody', 'powdery', 'vanilla', 'fruity', 'cinnamon', 'sweet', 'citrus', 'aromatic', 'balsamic']","['Maurice Roger', 'Pierre Bourdon']","Dolce VitabyDioris a Amber Woody fragrance for women.Dolce Vitawas launched in 1994. Dolce Vita was created by Pierre Bourdon and Maurice Roger. Top notes are Peach, Cardamom, Lily, Grapefruit, Bergamot and Rose; middle notes are Cinnamon, Apricot, Brazilian Rosewood, Lily, Heliotrope and Magnolia; base notes are Vanilla, Sandalwood, Cedar and Coconut."
Dolce Vita Parfum Diorfor women,for women,4.48,152,"['warm spicy', 'powdery', 'woody', 'vanilla', 'fruity', 'citrus', 'sweet', 'floral', 'cinnamon', 'lactonic']","['Maurice Roger', 'Pierre Bourdon']","Dolce Vita ParfumbyDioris a Floral fragrance for women.Dolce Vita Parfumwas launched in 1994. Dolce Vita Parfum was created by Pierre Bourdon and Maurice Roger. Top notes are Peach, Cardamom, Lily, Bergamot, Rose and Grapefruit; middle notes are Apricot, Cinnamon, Palisander Rosewood, Heliotrope, Lily and Magnolia; base notes are Vanilla, Coconut, Sandalwood and Cedar."
Eau de Cologne aux Fleurs Fraiches Diorfor women and men,for women and men,2.6,5,"['white floral', 'mossy', 'citrus', 'earthy', 'rose', 'fresh', 'floral']",['Edmond Roudnitska'],"Eau de Cologne aux Fleurs FraichesbyDioris a Chypre Floral fragrance for women and men.Eau de Cologne aux Fleurs Fraicheswas launched during the 1950's. The nose behind this fragrance is Edmond Roudnitska. Top notes are Lemon and Lemon Verbena; middle notes are Jasmine, Rose Water and Lily of the Valley; base note is Oakmoss."
Eau de Cologne Fraîche Diorfor women and men,for women and men,4.48,23,"['citrus', 'vanilla', 'mossy', 'earthy', 'woody', 'sweet', 'balsamic', 'powdery', 'aromatic']",['Edmond Roudnitska'],"Eau de Cologne FraîchebyDioris a Chypre Floral fragrance for women and men.Eau de Cologne Fraîchewas launched in 1952. The nose behind this fragrance is Edmond Roudnitska. Top notes are Lemon and Lemon Verbena; middle notes are Palisander Rosewood, Jasmine and Rose; base notes are Oakmoss and Patchouli."
Eau de Dior Coloressence Energizing Diorfor women,for women,4.17,128,"['citrus', 'aromatic', 'floral', 'fresh spicy', 'green', 'powdery']",['Max Gavarry'],"Eau de Dior Coloressence EnergizingbyDioris a Aromatic fragrance for women.Eau de Dior Coloressence Energizingwas launched in 2000. The nose behind this fragrance is Max Gavarry. Top notes are Lemon Verbena, Lemon, Mint and Orange; middle notes are Magnolia, Violet and Rose; base notes are Musk and Fir."
Eau de Dior Coloressence Relaxing Diorfor women,for women,3.76,123,"['woody', 'powdery', 'vanilla', 'violet', 'citrus', 'floral', 'rose']",['Domitille Michalon Bertier'],"Eau de Dior Coloressence RelaxingbyDioris a Floral Woody Musk fragrance for women.Eau de Dior Coloressence Relaxingwas launched in 2000. The nose behind this fragrance is Domitille Michalon Bertier. Top notes are Fig Tree, Lemon Tree and Bergamot; middle notes are Violet, Heliotrope and Rose; base notes are Sandalwood, Cedar, Tonka Bean, Vanilla and White Musk."
Eau de Dolce Vita Diorfor women,for women,3.95,669,"['floral', 'citrus', 'fresh spicy', 'fresh', 'fruity', 'woody']",['Jacques Cavallier'],"Eau de Dolce VitabyDioris a Floral Fruity fragrance for women.Eau de Dolce Vitawas launched in 1998. The nose behind this fragrance is Jacques Cavallier. Top notes are Grapefruit, Bergamot and Mandarin Orange; middle notes are Peony, Freesia, White Pepper, Jasmine and Hedione; base notes are Osmanthus, Sandalwood, Vanilla and White Musk."
Eau Fraiche Diorfor women,for women,4.27,186,"['citrus', 'woody', 'mossy', 'earthy', 'sweet']",['Edmond Roudnitska'],Eau FraichebyDioris a Chypre Floral fragrance for women.Eau Fraichewas launched in 1952. The nose behind this fragrance is Edmond Roudnitska. Top notes are Lemon and Mandarin Orange; middle note is Palisander Rosewood; base notes are Oakmoss and Vanilla.
Jules Diorfor men,for men,4.36,463,"['aromatic', 'fresh spicy', 'woody', 'mossy', 'floral', 'leather', 'herbal', 'earthy', 'fresh', 'powdery']",['Jean Martel'],"JulesbyDioris a Aromatic Green fragrance for men.Juleswas launched in 1980. The nose behind this fragrance is Jean Martel. Top notes are Artemisia, Lavender, Caraway and Bergamot; middle notes are Carnation, Rose, Basil, Cedar, Cyclamen, Jasmine and Sandalwood; base notes are Oakmoss, Leather, Fir, Musk, Amber and Tonka Bean."
Lily Diorfor women,for women,3.97,76,"['white floral', 'green', 'floral', 'fresh', 'woody']",['Florence Idier'],"LilybyDioris a Floral fragrance for women.Lilywas launched in 1999. The nose behind this fragrance is Florence Idier. Top notes are Green Notes, Fruity Notes, Bergamot and Brazilian Rosewood; middle notes are Lily-of-the-Valley, Lilac, Lily, Jasmine and Rose; base notes are Musk and Sandalwood."
Remember Me Diorfor women,for women,4.2,425,"['floral', 'green', 'white floral', 'powdery', 'fresh', 'fresh spicy', 'citrus', 'violet', 'yellow floral', 'woody']",['Nathalie Lorson'],"Remember MebyDioris a Floral Green fragrance for women.Remember Mewas launched in 2000. The nose behind this fragrance is Nathalie Lorson. Top notes are Hiacynth, Yuzu and Bergamot; middle notes are Lily-of-the-Valley, Lilac, Mimosa, Violet and Jasmine; base notes are Iris, Cedar and Sandalwood."
Cruise Collection - Escale a Portofino Diorfor women,for women,4.06,"2,349","['citrus', 'aromatic', 'fresh spicy', 'woody', 'white floral', 'green']",['François Demachy'],"Cruise Collection - Escale a PortofinobyDioris a Citrus Aromatic fragrance for women.Cruise Collection - Escale a Portofinowas launched in 2008. The nose behind this fragrance is François Demachy. Top notes are Bergamot, Lemon and Petitgrain; middle notes are Orange Blossom, Juniper Berries and Almond; base notes are Cypress, Cedar, Musk, Galbanum and Caraway."
Cruise Collection Escale a Parati Diorfor women and men,for women and men,3.73,527,"['citrus', 'aromatic', 'woody', 'green', 'fresh spicy', 'fresh', 'warm spicy']",['François Demachy'],"Cruise Collection Escale a ParatibyDioris a Citrus fragrance for women and men.Cruise Collection Escale a Paratiwas launched in 2012. The nose behind this fragrance is François Demachy. Top notes are Petitgrain, Lemon and Bitter Orange; middle notes are Mint, Palisander Rosewood, Cinnamon and Red Berries; base notes are Woodsy Notes and Tonka Bean."
