Name,Gender,Rating Value,Rating Count,Main Accords,Perfumers,Description
Chance Eau de Parfum Chanelfor women,for women,4.05,"5,409","['musky', 'patchouli', 'powdery', 'white floral', 'woody', 'soft spicy', 'earthy', 'vanilla', 'warm spicy', 'iris']",['Jacques Polge'],"Chance Eau de ParfumbyChanelis a Chypre Floral fragrance for women.Chance Eau de Parfumwas launched in 2005. The nose behind this fragrance is Jacques Polge. Top note is Pink Pepper; middle notes are Jasmine and Iris; base notes are Patchouli, Musk and Vanilla."
Chance Eau de Toilette Chanelfor women,for women,3.93,"11,921","['patchouli', 'woody', 'sweet', 'earthy', 'citrus', 'musky', 'fruity', 'soft spicy', 'aromatic', 'powdery']",['Jacques Polge'],"Chance Eau de ToilettebyChanelis a Chypre Floral fragrance for women.Chance Eau de Toilettewas launched in 2002. The nose behind this fragrance is Jacques Polge. Top notes are Patchouli, Pink Pepper, Pineapple, Hiacynth and Iris; middle notes are Lemon, Jasmine and Rose; base notes are Patchouli, Musk, Vetiver and Vanilla."
Chance Eau Fraiche Chanelfor women,for women,4.08,"13,987","['woody', 'citrus', 'aromatic', 'floral', 'musky', 'powdery', 'earthy', 'white floral', 'patchouli', 'fresh']",['Jacques Polge'],"Chance Eau FraichebyChanelis a Chypre Floral fragrance for women.Chance Eau Fraichewas launched in 2007. The nose behind this fragrance is Jacques Polge. Top notes are Lemon, Cedar and Citron; middle notes are Water Hyacinth, Pink Pepper and Jasmine; base notes are White Musk, Patchouli, Vetiver, Teak Wood, Iris and Amber."
Chance Eau Fraiche Eau de Parfum Chanelfor women,for women,4.11,752,"['citrus', 'aldehydic', 'woody', 'fresh', 'white floral', 'amber']",['Olivier Polge'],Chance Eau Fraiche Eau de ParfumbyChanelis a fragrance for women. This is a new fragrance.Chance Eau Fraiche Eau de Parfumwas launched in 2023. The nose behind this fragrance is Olivier Polge. Top notes are Citron and Aldehydes; middle note is Jasmine; base notes are Teak Wood and Amber.
Chance Eau Tendre Chanelfor women,for women,4.12,"17,053","['floral', 'fruity', 'citrus', 'sweet', 'fresh spicy', 'powdery', 'white floral', 'musky', 'green', 'iris']",['Jacques Polge'],"Chance Eau TendrebyChanelis a Floral Fruity fragrance for women.Chance Eau Tendrewas launched in 2010. The nose behind this fragrance is Jacques Polge. Top notes are Quince and Grapefruit; middle notes are Hyacinth and Jasmine; base notes are Musk, Iris, Virginia Cedar and Amber."
Chance Eau Tendre Eau de Parfum Chanelfor women,for women,4.22,"3,272","['rose', 'fruity', 'citrus', 'musky', 'floral', 'sweet', 'white floral', 'powdery', 'fresh', 'fresh spicy']",['Olivier Polge'],Chance Eau Tendre Eau de ParfumbyChanelis a Floral Fruity fragrance for women.Chance Eau Tendre Eau de Parfumwas launched in 2019. The nose behind this fragrance is Olivier Polge. Top notes are Quince and Grapefruit; middle notes are Rose and Jasmine; base note is White Musk.
Chance Eau Vive Chanelfor women,for women,3.8,"3,802","['citrus', 'woody', 'fresh spicy', 'powdery', 'white floral', 'aromatic', 'musky']",['Olivier Polge'],"Chance Eau VivebyChanelis a Floral Woody Musk fragrance for women.Chance Eau Vivewas launched in 2015. The nose behind this fragrance is Olivier Polge. Top notes are Blood Orange, Grapefruit and Citruses; middle notes are Jasmine and White Musk; base notes are Vetiver, Cedar and Iris."
Chance Parfum Chanelfor women,for women,3.96,396,"['powdery', 'iris', 'white floral', 'musky', 'vanilla', 'violet', 'earthy', 'floral', 'sweet']",['Jacques Polge'],Chance ParfumbyChanelis a Chypre Floral fragrance for women.Chance Parfumwas launched in 2003. The nose behind this fragrance is Jacques Polge.
Chanel N°19 Chanelfor women,for women,4.1,"5,166","['green', 'earthy', 'woody', 'iris', 'powdery', 'aromatic', 'floral', 'mossy', 'white floral', 'fresh spicy']",['Henri Robert'],"Chanel N°19byChanelis a Floral Green fragrance for women.Chanel N°19was launched in 1970. The nose behind this fragrance is Henri Robert. Top notes are Galbanum, Hiacynth, Bergamot and Neroli; middle notes are Iris, Orris Root, Rose, Lily-of-the-Valley, Narcissus, Jasmine and Ylang-Ylang; base notes are Oakmoss, Vetiver, Leather, Cedar, Musk and Sandalwood."
Chanel No 19 Poudre Chanelfor women,for women,4.13,"5,405","['iris', 'green', 'powdery', 'aromatic', 'earthy', 'woody', 'violet', 'white floral', 'musky', 'citrus']",['Jacques Polge'],"Chanel No 19 PoudrebyChanelis a Floral Woody Musk fragrance for women.Chanel No 19 Poudrewas launched in 2011. The nose behind this fragrance is Jacques Polge. Top notes are Galbanum, Neroli and Mandarin Orange; middle notes are Iris and Jasmine; base notes are Vetiver, Musk and Tonka Bean."
Chanel N°5 (Vintage) Chanelfor women,for women,3.94,189,"['aldehydic', 'powdery', 'woody', 'fresh', 'white floral', 'iris', 'musky', 'citrus', 'earthy', 'yellow floral']",['Ernest Beaux'],"Chanel N°5 (Vintage)byChanelis a Floral Aldehyde fragrance for women.Chanel N°5 (Vintage)was launched in 1921. The nose behind this fragrance is Ernest Beaux. Top notes are Aldehydes, Ylang-Ylang, Neroli, Lemon and Bergamot; middle notes are Rose, Iris, Jasmine, Orris Root and Lily-of-the-Valley; base notes are Civet, Amber, Sandalwood, Musk, Vanilla, Oakmoss, Patchouli and Vetiver."
Chanel N°5 Eau Premiere Chanelfor women,for women,4.22,"6,131","['woody', 'aldehydic', 'fresh', 'white floral', 'yellow floral', 'vanilla', 'sweet', 'rose', 'floral', 'powdery']",['Jacques Polge'],"Chanel N°5 Eau PremierebyChanelis a Floral Aldehyde fragrance for women.Chanel N°5 Eau Premierewas launched in 2008. The nose behind this fragrance is Jacques Polge. Top notes are Aldehydes, Ylang-Ylang and Neroli; middle notes are Jasmine and Tincture of Rose; base notes are Vanille, Sandalwood and Vetyver."
Chanel No 5 Eau de Cologne Chanelfor women,for women,4.05,910,"['powdery', 'woody', 'musky', 'white floral', 'earthy', 'iris', 'animalic', 'aldehydic', 'fresh', 'amber']",['Ernest Beaux'],"Chanel No 5 Eau de ColognebyChanelis a Floral Aldehyde fragrance for women. The nose behind this fragrance is Ernest Beaux. Top notes are Aldehydes, Ylang-Ylang, African Orange Flower, Bergamot and Amalfi Lemon; middle notes are Iris, Jasmine, Rose, Orris Root and Lily-of-the-Valley; base notes are Civetta, Musk, Amber, Sandalwood, Vetiver, oak moss, Patchouli and Vanille."
Chanel No 5 Eau de Parfum Chanelfor women,for women,3.65,"8,794","['woody', 'aldehydic', 'fresh', 'white floral', 'powdery', 'earthy', 'yellow floral', 'iris', 'citrus', 'floral']",['Jacques Polge'],"Chanel No 5 Eau de ParfumbyChanelis a Floral Aldehyde fragrance for women.Chanel No 5 Eau de Parfumwas launched in 1986. The nose behind this fragrance is Jacques Polge. Top notes are Aldehydes, Ylang-Ylang, Neroli, Bergamot and Peach; middle notes are Iris, Jasmine, Rose and Lily-of-the-Valley; base notes are Sandalwood, Vanilla, Oakmoss, Vetiver and Patchouli."
Chanel No 5 Eau de Parfum 100th Anniversary – Ask For The Moon Limited Edition Chanelfor women,for women,4.27,70,"['woody', 'aldehydic', 'earthy', 'fresh', 'powdery', 'iris', 'yellow floral', 'mossy', 'white floral', 'citrus']",['Jacques Polge'],"Chanel No 5 Eau de Parfum 100th Anniversary – Ask For The Moon Limited EditionbyChanelis a Floral Aldehyde fragrance for women.Chanel No 5 Eau de Parfum 100th Anniversary – Ask For The Moon Limited Editionwas launched in 2021. The nose behind this fragrance is Jacques Polge. Top notes are Aldehydes, Ylang-Ylang, Bergamot, Peach and Neroli; middle notes are Iris, Lily-of-the-Valley, Rose and Jasmine; base notes are Sandalwood, Oakmoss, Patchouli, Vetiver and Vanilla."
Chanel No 5 Eau de Parfum Red Edition Chanelfor women,for women,4.39,409,"['woody', 'white floral', 'powdery', 'fresh', 'yellow floral', 'aldehydic', 'earthy', 'iris', 'sweet', 'citrus']",['Jacques Polge'],"Chanel No 5 Eau de Parfum Red EditionbyChanelis a Floral Aldehyde fragrance for women.Chanel No 5 Eau de Parfum Red Editionwas launched in 2018. The nose behind this fragrance is Jacques Polge. Top notes are Ylang-Ylang, Aldehydes, Neroli, Bergamot and Peach; middle notes are Iris, Jasmine, Rose and Lily-of-the-Valley; base notes are Sandalwood, Vanilla, Oakmoss, Vetiver and Patchouli."
Chanel No 5 Eau de Toilette Chanelfor women,for women,4.01,"5,528","['woody', 'powdery', 'aldehydic', 'fresh', 'iris', 'earthy', 'white floral', 'citrus', 'musky', 'yellow floral']",['Ernest Beaux'],"Chanel No 5 Eau de ToilettebyChanelis a Floral Aldehyde fragrance for women.Chanel No 5 Eau de Toilettewas launched in 1924. The nose behind this fragrance is Ernest Beaux. Top notes are Aldehydes, Ylang-Ylang, Neroli, Amalfi Lemon and Bergamot; middle notes are Iris, Jasmine, Rose, Orris Root and Lily-of-the-Valley; base notes are Civetta, Musk, Sandalwood, oak moss, Vetiver, Amber, Vanille and Patchouli."
Chanel No 5 Eau Premiere (2015) Chanelfor women,for women,4.33,"4,007","['aldehydic', 'woody', 'fresh', 'yellow floral', 'white floral', 'vanilla', 'sweet', 'powdery', 'floral', 'soapy']",['Jacques Polge'],"Chanel No 5 Eau Premiere (2015)byChanelis a Floral Aldehyde fragrance for women.Chanel No 5 Eau Premiere (2015)was launched in 2015. The nose behind this fragrance is Jacques Polge. Top notes are Aldehydes, Ylang-Ylang and Neroli; middle notes are Jasmine and Rose; base notes are Vanilla, Sandalwood and Vetiver."
Chanel No 5 L'Eau Chanelfor women,for women,4.13,"5,868","['citrus', 'aldehydic', 'fresh', 'woody', 'powdery', 'yellow floral', 'sweet', 'white floral', 'musky']",['Olivier Polge'],"Chanel No 5 L'EaubyChanelis a Floral Aldehyde fragrance for women.Chanel No 5 L'Eauwas launched in 2016. The nose behind this fragrance is Olivier Polge. Top notes are Aldehydes, Lemon, Neroli, Mandarin Orange, Bergamot, Orange and Lime; middle notes are Ylang-Ylang, Jasmine and May Rose; base notes are White Musk, Orris Root, Cedar and Vanila."
Chanel No 5 L'Eau Eau De Toilette 100th Anniversary – Ask For The Moon Limited Edition Chanelfor women,for women,4.03,100,"['citrus', 'powdery', 'aldehydic', 'fresh', 'white floral', 'woody', 'musky', 'aromatic', 'iris', 'sweet']",['Olivier Polge'],"Chanel No 5 L'Eau Eau De Toilette 100th Anniversary – Ask For The Moon Limited EditionbyChanelis a Floral Aldehyde fragrance for women.Chanel No 5 L'Eau Eau De Toilette 100th Anniversary – Ask For The Moon Limited Editionwas launched in 2021. The nose behind this fragrance is Olivier Polge. Top notes are Lemon, Aldehydes, Lime, Bergamot, Neroli, Mandarin Orange and Orange; middle notes are Jasmine, Ylang-Ylang and May Rose; base notes are White Musk, Orris, Cedar and Vanilla."
Chanel No 5 L'Eau Red Edition Chanelfor women,for women,4.48,312,"['citrus', 'aldehydic', 'woody', 'powdery', 'fresh', 'white floral', 'iris', 'sweet', 'yellow floral', 'vanilla']",['Olivier Polge'],"Chanel No 5 L'Eau Red EditionbyChanelis a Floral Aldehyde fragrance for women.Chanel No 5 L'Eau Red Editionwas launched in 2018. The nose behind this fragrance is Olivier Polge. Top notes are Aldehydes, Lemon, Orange, Neroli, Bergamot, Lime and Mandarin Orange; middle notes are Ylang-Ylang, Jasmine and May Rose; base notes are Orris, Vanilla, Cedar and White Musk."
Chanel No 5 Parfum Chanelfor women,for women,3.69,"13,217","['powdery', 'woody', 'aldehydic', 'iris', 'fresh', 'white floral', 'musky', 'earthy', 'citrus', 'yellow floral']",['Ernest Beaux'],"Chanel No 5 ParfumbyChanelis a Floral Aldehyde fragrance for women.Chanel No 5 Parfumwas launched in 1921. The nose behind this fragrance is Ernest Beaux. Top notes are Aldehydes, Ylang-Ylang, Neroli, Bergamot and Lemon; middle notes are Iris, Jasmine, Rose, Orris Root and Lily-of-the-Valley; base notes are Civet, Musk, Sandalwood, Amber, Moss, Vanilla, Vetiver and Patchouli."
Chanel No 5 Parfum Baccarat Grand Extrait Chanelfor women,for women,4,9,"['woody', 'earthy', 'powdery', 'musky', 'amber', 'iris', 'animalic', 'mossy', 'patchouli', 'warm spicy']",['Jacques Polge'],"Chanel No 5 Parfum Baccarat Grand ExtraitbyChanelis a Floral Aldehyde fragrance for women.Chanel No 5 Parfum Baccarat Grand Extraitwas launched in 2021. The nose behind this fragrance is Jacques Polge. Top notes are Aldehydes, Ylang-Ylang, Neroli, Bergamot and Lemon; middle notes are Iris, Rose, Orris, Jasmine and Lily-of-the-Valley; base notes are Civet, Moss, Patchouli, Amber, Sandalwood, Vetiver, Vanilla and Musk."
N°5 L’EAU – Limited edition Chanelfor women,for women,4.47,47,"['citrus', 'aldehydic', 'woody', 'fresh', 'powdery', 'sweet', 'musky']",['Olivier Polge'],"N°5 L’EAU – Limited editionbyChanelis a fragrance for women. This is a new fragrance.N°5 L’EAU – Limited editionwas launched in 2024. The nose behind this fragrance is Olivier Polge. Top notes are Aldehydes, Lime, Orange, Mandarin Orange, Lemon, Bergamot and Neroli; middle notes are May Rose, Ylang-Ylang and Jasmine; base notes are Cedar, White Musk, Orris Root and Vanila."
Coco Eau de Parfum Chanelfor women,for women,4.26,"12,365","['amber', 'warm spicy', 'sweet', 'powdery', 'woody', 'vanilla', 'white floral', 'rose', 'floral', 'animalic']",['Jacques Polge'],"Coco Eau de ParfumbyChanelis a Amber Spicy fragrance for women.Coco Eau de Parfumwas launched in 1984. The nose behind this fragrance is Jacques Polge. Top notes are Bulgarian Rose, Coriander, Peach, Jasmine and Mandarin Orange; middle notes are Cloves, Rose, Orange Blossom, Mimosa and Clover; base notes are Amber, Sandalwood, Tonka Bean, Opoponax, Civet, Vanilla and Labdanum."
Coco Eau de Toilette Chanelfor women,for women,4.36,"2,412","['amber', 'warm spicy', 'sweet', 'powdery', 'woody', 'floral', 'white floral', 'rose', 'balsamic', 'vanilla']",['Jacques Polge'],"Coco Eau de ToilettebyChanelis a Amber Spicy fragrance for women. The nose behind this fragrance is Jacques Polge. Top notes are Bulgarian Rose, Coriander, Peach, Mandarin Orange and Jasmine; middle notes are Cloves, Rose, Mimosa, Orange Blossom and Clover; base notes are Sandalwood, Opoponax, Amber, Civet, Vanilla, Labdanum and Tonka Bean."
Coco Mademoiselle Chanelfor women,for women,4.12,"29,283","['citrus', 'woody', 'patchouli', 'sweet', 'white floral', 'rose', 'earthy', 'vanilla', 'warm spicy', 'yellow floral']",['Jacques Polge'],"Coco MademoisellebyChanelis a Amber Floral fragrance for women.Coco Mademoisellewas launched in 2001. The nose behind this fragrance is Jacques Polge. Top notes are Orange, Mandarin Orange, Bergamot and Orange Blossom; middle notes are Turkish Rose, Jasmine, Mimosa and Ylang-Ylang; base notes are Patchouli, White Musk, Vanilla, Vetiver, Tonka Bean and Opoponax. This perfume is the winner of awardFiFi Award Best National Advertising Campaign / TV 2008."
Coco Mademoiselle Eau de Toilette Chanelfor women,for women,4.2,"5,748","['citrus', 'patchouli', 'woody', 'fresh spicy', 'earthy', 'rose', 'aromatic', 'white floral', 'warm spicy', 'fruity']",['Jacques Polge'],"Coco Mademoiselle Eau de ToilettebyChanelis a Amber Floral fragrance for women.Coco Mademoiselle Eau de Toilettewas launched in 2002. The nose behind this fragrance is Jacques Polge. Top notes are Orange, Bergamot and Grapefruit; middle notes are Litchi, Rose and Italian Jasmine; base notes are Patchouli, Tahitian Vetiver, Bourbon Vanilla and White Musk."
Coco Mademoiselle Intense Chanelfor women,for women,4.27,"4,743","['citrus', 'vanilla', 'patchouli', 'sweet', 'woody', 'warm spicy', 'amber', 'balsamic', 'rose', 'fruity']",['Olivier Polge'],"Coco Mademoiselle IntensebyChanelis a Amber Woody fragrance for women.Coco Mademoiselle Intensewas launched in 2018. The nose behind this fragrance is Olivier Polge. Top notes are Sicilian Orange, Calabrian bergamot and Lemon; middle notes are Rose, Fruity Notes and Jasmine; base notes are Patchouli, Madagascar Vanilla, Tonka Bean, White Musk and Labdanum."
Coco Mademoiselle L'Eau Chanelfor women,for women,4.22,69,"['citrus', 'rose', 'white floral', 'musky', 'floral', 'fresh spicy', 'powdery', 'sweet']",['Olivier Polge'],Coco Mademoiselle L'EaubyChanelis a Chypre Fruity fragrance for women.Coco Mademoiselle L'Eauwas launched in 2021. The nose behind this fragrance is Olivier Polge. Top notes are Orange and Bergamot; middle notes are Rose and Jasmine; base note is White Musk.
Coco Mademoiselle L'Eau Privée Chanelfor women,for women,4.04,"1,027","['citrus', 'rose', 'musky', 'white floral', 'powdery', 'floral']",['Olivier Polge'],Coco Mademoiselle L'Eau PrivéebyChanelis a Amber Floral fragrance for women.Coco Mademoiselle L'Eau Privéewas launched in 2020. The nose behind this fragrance is Olivier Polge. Top note is Mandarin Orange; middle notes are Rose and Jasmine; base note is White Musk.
Coco Mademoiselle L’Extrait Chanelfor women,for women,4.23,208,"['citrus', 'woody', 'powdery', 'earthy', 'rose', 'iris', 'white floral', 'patchouli', 'aromatic', 'musky']",['Jacques Polge'],"Coco Mademoiselle L’ExtraitbyChanelis a Amber Floral fragrance for women.Coco Mademoiselle L’Extraitwas launched in 2012. The nose behind this fragrance is Jacques Polge. Top notes are Orange and Bergamot; middle notes are Rose, Iris and Jasmine; base notes are Patchouli, Musk, Vetiver and Vanilla."
Coco Mademoiselle Parfum Chanelfor women,for women,4.26,"3,331","['citrus', 'woody', 'patchouli', 'rose', 'fresh spicy', 'earthy', 'aromatic', 'white floral', 'vanilla', 'musky']",['Jacques Polge'],"Coco Mademoiselle ParfumbyChanelis a Amber Floral fragrance for women. The nose behind this fragrance is Jacques Polge. Top notes are Bergamot, Orange and Grapefruit; middle notes are Rose, Litchi and Jasmine; base notes are Patchouli, Vanilla, Musk and Vetiver."
Coco Noir Chanelfor women,for women,4.12,"10,815","['warm spicy', 'woody', 'citrus', 'fresh spicy', 'amber', 'aromatic', 'patchouli', 'vanilla', 'rose', 'balsamic']","['Christopher Sheldrake', 'Jacques Polge']","Coco NoirbyChanelis a Amber Woody fragrance for women.Coco Noirwas launched in 2012. Coco Noir was created by Jacques Polge and Christopher Sheldrake. Top notes are Grapefruit, Bergamot and Orange; middle notes are Rose, Geranium, Jasmine, Narcissus and Peach; base notes are Patchouli, Sandalwood, Olibanum, Tonka Bean, Vanille, White Musk, Cloves and Benzoin."
Coco Noir Extrait Chanelfor women,for women,4.26,314,"['warm spicy', 'citrus', 'amber', 'woody', 'fresh spicy', 'aromatic', 'vanilla', 'powdery', 'rose', 'balsamic']","['Christopher Sheldrake', 'Jacques Polge']","Coco Noir ExtraitbyChanelis a Chypre Floral fragrance for women.Coco Noir Extraitwas launched in 2014. Coco Noir Extrait was created by Jacques Polge and Christopher Sheldrake. Top notes are Grapefruit, Bergamot, Aldehydes and Lemon; middle notes are Rose, Geranium, Narcissus, Jasmine and Cloves; base notes are Patchouli, Olibanum, Sandalwood, Tonka Bean, Vanilla, White Musk, Benzoin and Orris Root."
Coco Parfum Chanelfor women,for women,4.45,661,"['amber', 'sweet', 'powdery', 'warm spicy', 'white floral', 'floral', 'rose', 'woody', 'musky', 'animalic']",['Jacques Polge'],"Coco ParfumbyChanelis a Amber Floral fragrance for women. The nose behind this fragrance is Jacques Polge. Top notes are Bulgarian Rose, Coriander, Peach, Jasmine and Mandarin Orange; middle notes are Rose, Cloves, Mimosa, Orange Blossom and Clover; base notes are Amber, Opoponax, Civet, Sandalwood, Labdanum, Vanilla and Tonka Bean."
Cristalle Eau de Parfum Chanelfor women,for women,4.13,"2,019","['earthy', 'woody', 'mossy', 'aromatic', 'fruity', 'white floral', 'sweet', 'citrus', 'ozonic', 'yellow floral']",['Jacques Polge'],"Cristalle Eau de ParfumbyChanelis a Chypre Floral fragrance for women.Cristalle Eau de Parfumwas launched in 1993. The nose behind this fragrance is Jacques Polge. Top note is Mandarin Orange; middle notes are Melon, Jasmine, Peach and Ylang-Ylang; base notes are Oakmoss and Vetiver."
Cristalle Eau de Toilette Chanelfor women,for women,4.11,"3,951","['citrus', 'earthy', 'woody', 'mossy', 'aromatic', 'fresh spicy', 'floral', 'green']",['Henri Robert'],"Cristalle Eau de ToilettebyChanelis a Citrus Aromatic fragrance for women.Cristalle Eau de Toilettewas launched in 1974. The nose behind this fragrance is Henri Robert. Top notes are Sicilian Lemon and Bergamot; middle notes are Hiacynth, Brazilian Rosewood, Honeysuckle and Jasmine; base notes are Oakmoss and Vetiver."
Cristalle Eau Verte Chanelfor women,for women,4.19,"4,997","['citrus', 'floral', 'white floral', 'aromatic', 'fresh spicy']",['Jacques Polge'],"Cristalle Eau VertebyChanelis a Floral Green fragrance for women.Cristalle Eau Vertewas launched in 2009. The nose behind this fragrance is Jacques Polge. Top notes are Amalfi Lemon and Bergamot; middle notes are Neroli and Magnolia; base notes are Jasmine, Iris and Musk."
Egoiste Chanelfor men,for men,4.21,"6,511","['woody', 'warm spicy', 'cinnamon', 'rose', 'tobacco', 'aromatic', 'sweet', 'powdery', 'floral', 'balsamic']",['Jacques Polge'],"EgoistebyChanelis a Woody Spicy fragrance for men.Egoistewas launched in 1990. The nose behind this fragrance is Jacques Polge. Top notes are Brazilian Rosewood, Coriander, Mahogany and Sicilian Mandarin; middle notes are Cinnamon, Damask Rose and Carnation; base notes are Sandalwood, Tobacco, Vanilla, Leather, Amber and Ambrette (Musk Mallow)."
Egoiste Platinum Chanelfor men,for men,4.22,"10,102","['aromatic', 'fresh spicy', 'woody', 'lavender', 'green', 'herbal']",['Jacques Polge'],"Egoiste PlatinumbyChanelis a Woody Floral Musk fragrance for men.Egoiste Platinumwas launched in 1993. The nose behind this fragrance is Jacques Polge. Top notes are Lavender, Rosemary, Neroli and Petitgrain; middle notes are Geranium, Clary Sage, Galbanum and Jasmine; base notes are Oakmoss, Vetiver, Cedar, Sandalwood and Amber."
Gabrielle Chanelfor women,for women,3.67,"6,989","['white floral', 'citrus', 'woody', 'sweet', 'fruity', 'musky', 'yellow floral', 'powdery', 'tuberose', 'animalic']",['Olivier Polge'],"GabriellebyChanelis a Floral fragrance for women.Gabriellewas launched in 2017. The nose behind this fragrance is Olivier Polge. Top notes are Grapefruit, Mandarin Orange and Black Currant; middle notes are Orange Blossom, Jasmine, Ylang-Ylang, Tuberose, Lily-of-the-Valley, Pear and Pink Pepper; base notes are Musk, Sandalwood, Cashmeran and Orris."
Gabrielle Chanel Hair Mist Chanelfor women,for women,4,113,"['white floral', 'citrus', 'woody', 'musky', 'powdery', 'sweet', 'fruity', 'tuberose', 'animalic']",['Olivier Polge'],"Gabrielle Chanel Hair MistbyChanelis a Floral fragrance for women.Gabrielle Chanel Hair Mistwas launched in 2019. The nose behind this fragrance is Olivier Polge. Top notes are Grapefruit, Mandarin Orange and Black Currant; middle notes are Orange Blossom, Tuberose, Jasmine, Pear, Pink Pepper, Lily-of-the-Valley and Ylang-Ylang; base notes are Musk, Sandalwood, Cashmeran and Orris."
Gabrielle Essence Chanelfor women,for women,4.03,"3,148","['white floral', 'citrus', 'sweet', 'fruity', 'tuberose', 'woody', 'yellow floral', 'animalic', 'powdery', 'fresh']",['Olivier Polge'],"Gabrielle EssencebyChanelis a Floral Woody Musk fragrance for women.Gabrielle Essencewas launched in 2019. The nose behind this fragrance is Olivier Polge. Top notes are Citruses, Peach, Red Fruits, Petitgrain and Black Currant; middle notes are White Flowers, Tuberose, Ylang-Ylang, Jasmine, Orange Blossom and Coconut; base notes are Musk, Vanilla and Sandalwood."
Gabrielle L'Eau Chanelfor women,for women,3.53,38,"['white floral', 'fruity', 'sweet', 'musky', 'green', 'powdery', 'yellow floral', 'tuberose', 'fresh', 'animalic']",['Olivier Polge'],"Gabrielle L'EaubyChanelis a Floral Fruity fragrance for women. This is a new fragrance.Gabrielle L'Eauwas launched in 2024. The nose behind this fragrance is Olivier Polge. Top notes are Red Berries and Green Notes; middle notes are Orange Blossom, Ylang Ylang, Tuberose and Jasmine; base notes are Musk and Sandalwood."
Gabrielle Parfum Chanelfor women,for women,3.93,435,"['white floral', 'tuberose', 'sweet', 'yellow floral', 'woody', 'vanilla', 'animalic']",['Olivier Polge'],Gabrielle ParfumbyChanelis a Floral fragrance for women. This is a new fragrance.Gabrielle Parfumwas launched in 2022. The nose behind this fragrance is Olivier Polge.
Paris – Biarritz Chanelfor women and men,for women and men,4.06,860,"['citrus', 'green', 'fresh spicy', 'white floral']",['Olivier Polge'],"Paris – BiarritzbyChanelis a Floral Woody Musk fragrance for women and men.Paris – Biarritzwas launched in 2018. The nose behind this fragrance is Olivier Polge. Top notes are Tangerine, Bergamot, Lemon, Orange and Grapefruit; middle notes are Neroli, Green Notes and Lily-of-the-Valley; base notes are White Musk and Patchouli."
Paris – Deauville Chanelfor women and men,for women and men,4.15,"1,108","['citrus', 'green', 'fresh spicy', 'aromatic', 'patchouli', 'floral', 'fresh', 'woody']",['Olivier Polge'],"Paris – DeauvillebyChanelis a Chypre fragrance for women and men.Paris – Deauvillewas launched in 2018. The nose behind this fragrance is Olivier Polge. Top notes are Basil, Lime, Sicilian Orange, Bergamot, Petitgrain and Lemon; middle notes are Green Notes, Hedione, Jasmine and Rose; base note is Patchouli."
Paris – Édimbourg Chanelfor women and men,for women and men,4.29,923,"['woody', 'aromatic', 'fresh spicy', 'lavender']",['Olivier Polge'],"Paris – ÉdimbourgbyChanelis a Woody Aquatic fragrance for women and men.Paris – Édimbourgwas launched in 2021. The nose behind this fragrance is Olivier Polge. Top notes are Cypress and Juniper Berries; middle notes are Cedar, Lavender and Vetiver; base notes are Musk and Vanilla."
