Name,Gender,Rating Value,Rating Count,Main Accords,Perfumers,Description
Rose Essentielle Bvlgarifor women,for women,4.11,"2,870","['rose', 'powdery', 'floral', 'violet', 'woody', 'fruity']",['Beatrice Piquet'],"Rose EssentiellebyBvlgariis a Floral fragrance for women.Rose Essentiellewas launched in 2006. The nose behind this fragrance is Beatrice Piquet. Top notes are Rose, Violet and Blackberry; middle notes are Taif Rose, Mimosa and Jasmine; base notes are Musk, Sandalwood, Patchouli and Guaiac Wood."
Voile de Jasmin Bvlgarifor women,for women,3.89,797,"['white floral', 'powdery', 'yellow floral', 'floral', 'sweet', 'musky', 'citrus', 'iris', 'woody']",['Nathalie Lorson'],"Voile de JasminbyBvlgariis a Floral fragrance for women.Voile de Jasminwas launched in 2006. The nose behind this fragrance is Nathalie Lorson. Top notes are Mimosa, Orange Blossom and Bergamot; middle notes are Jasmine, Lily-of-the-Valley, Rose and Ylang-Ylang; base notes are Musk, Iris and Brazilian Rosewood."
Allegra Magnifying Myrrh Essence Bvlgarifor women,for women,3.77,39,"['amber', 'warm spicy', 'balsamic']",['Jacques Cavallier'],Allegra Magnifying Myrrh EssencebyBvlgariis a Amber fragrance for women. This is a new fragrance.Allegra Magnifying Myrrh Essencewas launched in 2022. The nose behind this fragrance is Jacques Cavallier.
Allegra Magnifying Neroli Essence Bvlgarifor women and men,for women and men,3.67,3,"['citrus', 'white floral', 'fresh', 'floral', 'fresh spicy', 'green', 'aromatic']",['Jacques Cavallier'],Allegra Magnifying Neroli EssencebyBvlgariis a Citrus fragrance for women and men. This is a new fragrance.Allegra Magnifying Neroli Essencewas launched in 2024. The nose behind this fragrance is Jacques Cavallier.
Baciami Bvlgarifor women,for women,4.36,311,"['vanilla', 'white floral', 'amber', 'powdery', 'lactonic', 'animalic']",['Jacques Cavallier'],BaciamibyBvlgariis a Amber Floral fragrance for women. This is a new fragrance.Baciamiwas launched in 2022. The nose behind this fragrance is Jacques Cavallier. Top note is Gardenia; middle note is Vanila; base note is Amber.
Chill & Sole Bvlgarifor women,for women,3.69,35,"['citrus', 'white floral', 'aromatic', 'fresh', 'green']","['Camille Cavallier', 'Jacques Cavallier']",Chill & SolebyBvlgariis a Citrus fragrance for women. This is a new fragrance.Chill & Solewas launched in 2024. Chill & Sole was created by Jacques Cavallier and Camille Cavallier.
Dolce Estasi Bvlgarifor women,for women,3.75,97,"['powdery', 'musky', 'vanilla', 'citrus', 'almond', 'floral', 'fresh']",['Jacques Cavallier'],Dolce EstasibyBvlgariis a Floral fragrance for women.Dolce Estasiwas launched in 2021. The nose behind this fragrance is Jacques Cavallier. Top note is Citruses; middle note is Heliotrope; base note is Musk.
Fantasia Veneta Bvlgarifor women,for women,3.68,82,"['patchouli', 'woody', 'warm spicy', 'fruity', 'earthy', 'balsamic', 'vanilla', 'sweet', 'powdery']",['Jacques Cavallier'],Fantasia VenetabyBvlgariis a Chypre Fruity fragrance for women.Fantasia Venetawas launched in 2021. The nose behind this fragrance is Jacques Cavallier. Top note is Red Peach; middle note is Indonesian Patchouli Leaf; base note is Vanilla.
Fiori D'Amore Bvlgarifor women,for women,3.78,115,"['rose', 'fruity', 'sweet', 'floral']",['Jacques Cavallier'],Fiori D'AmorebyBvlgariis a Floral Fruity fragrance for women.Fiori D'Amorewas launched in 2021. The nose behind this fragrance is Jacques Cavallier.
Riva Solare Bvlgarifor women,for women,3.83,137,"['citrus', 'musky', 'white floral', 'powdery', 'floral', 'fruity', 'sweet', 'animalic', 'fresh spicy']",['Jacques Cavallier'],"Riva SolarebyBvlgariis a Floral fragrance for women.Riva Solarewas launched in 2021. The nose behind this fragrance is Jacques Cavallier. Top note is Calabrian bergamot; middle notes are Orange Blossom, Osmanthus and Mandarin Orange; base note is Musk."
Rock'N'Rome Bvlgarifor women,for women,3.86,155,"['fruity', 'warm spicy', 'amber', 'floral', 'lactonic', 'woody', 'soft spicy', 'powdery']",['Jacques Cavallier'],"Rock'N'RomebyBvlgariis a Amber Floral fragrance for women.Rock'N'Romewas launched in 2021. The nose behind this fragrance is Jacques Cavallier. Top note is Apricot; middle notes are Osmanthus and Spices; base notes are Benzoin, Oriental notes and Woody Notes."
Spettacolore Bvlgarifor women,for women,4.26,118,"['amber', 'iris', 'powdery', 'violet', 'warm spicy', 'earthy']",['Jacques Cavallier'],SpettacolorebyBvlgariis a fragrance for women. This is a new fragrance.Spettacolorewas launched in 2022. The nose behind this fragrance is Jacques Cavallier. Top note is Iris; middle note is Myrhh; base note is Amber.
Aqva Amara Bvlgarifor men,for men,4.11,"4,743","['citrus', 'aquatic', 'fresh', 'amber', 'patchouli', 'white floral', 'fresh spicy', 'woody', 'warm spicy']",['Jacques Cavallier'],Aqva AmarabyBvlgariis a Woody Aquatic fragrance for men.Aqva Amarawas launched in 2014. The nose behind this fragrance is Jacques Cavallier. Top note is Sicilian Mandarin; middle notes are Watery Notes and Neroli; base notes are Olibanum and Indonesian Patchouli Leaf.
Aqva Divina Bvlgarifor women,for women,3.84,"2,181","['citrus', 'floral', 'salty', 'warm spicy', 'woody', 'fruity', 'fresh', 'marine', 'sweet', 'beeswax']",['Alberto Morillas'],"Aqva DivinabyBvlgariis a Floral Aquatic fragrance for women.Aqva Divinawas launched in 2015. The nose behind this fragrance is Alberto Morillas. Top notes are Salt, Ginger and Bergamot; middle notes are Quince and Magnolia; base notes are Woody Notes, Beeswax and Amber."
Aqva Pour Homme Bvlgarifor men,for men,4.15,"7,316","['citrus', 'marine', 'aromatic', 'aquatic', 'woody', 'lavender', 'fresh spicy', 'powdery']",['Jacques Cavallier'],"Aqva Pour HommebyBvlgariis a Aromatic Aquatic fragrance for men.Aqva Pour Hommewas launched in 2005. The nose behind this fragrance is Jacques Cavallier. Top notes are Mandarin Orange, Orange and Petitgrain; middle notes are Seaweed, Lavender and Cotton Flower; base notes are Virginia Cedar, Woodsy Notes, Patchouli, Clary Sage and Amber."
Aqva Pour Homme Atlantiqve Bvlgarifor men,for men,3.98,"2,361","['amber', 'aromatic', 'aquatic', 'marine', 'citrus', 'woody', 'fresh', 'animalic', 'salty', 'balsamic']",['Jacques Cavallier'],"Aqva Pour Homme AtlantiqvebyBvlgariis a Woody Aquatic fragrance for men.Aqva Pour Homme Atlantiqvewas launched in 2017. The nose behind this fragrance is Jacques Cavallier. Top notes are Water Notes, Calabrian bergamot, Sicilian Lemon and Sage; middle notes are Sea Notes, Ambergris and Apple; base notes are Benzoin, Amberwood, Vetiver, Patchouli and Sandalwood."
Aqva Pour Homme Marine Bvlgarifor men,for men,4.07,"3,975","['aquatic', 'citrus', 'aromatic', 'marine', 'fresh', 'fresh spicy', 'woody']",['Jacques Cavallier'],"Aqva Pour Homme MarinebyBvlgariis a Aromatic Aquatic fragrance for men.Aqva Pour Homme Marinewas launched in 2008. The nose behind this fragrance is Jacques Cavallier. Top notes are Grapefruit, Neroli, Mandarin Orange and Petitgrain; middle notes are Water Notes, Seaweed and Rosemary; base notes are Virginia Cedar and Amber."
Aqva Pour Homme Marine Toniq Bvlgarifor men,for men,3.86,280,"['aquatic', 'marine', 'woody', 'citrus', 'aromatic', 'fresh', 'fruity']",['Jacques Cavallier'],Aqva Pour Homme Marine ToniqbyBvlgariis a Aromatic Aquatic fragrance for men.Aqva Pour Homme Marine Toniqwas launched in 2011. The nose behind this fragrance is Jacques Cavallier. Top notes are Grapefruit and Pear; middle notes are Seaweed and Water Notes; base notes are Virginia Cedar and Sandalwood.
Aqva Pour Homme Toniq Bvlgarifor men,for men,4,250,"['aquatic', 'aromatic', 'marine', 'citrus', 'green', 'fresh']",['Jacques Cavallier'],Aqva Pour Homme ToniqbyBvlgariis a Aromatic Aquatic fragrance for men.Aqva Pour Homme Toniqwas launched in 2011. The nose behind this fragrance is Jacques Cavallier. Top notes are Amalfi Lemon and Mint; middle notes are Seaweed and Water Notes; base notes are Vetiver and Amber.
Bvlgari Eau Parfumee au The Vert Extreme Bvlgarifor women and men,for women and men,4.15,686,"['citrus', 'fresh spicy', 'aromatic', 'white floral', 'green', 'warm spicy', 'fresh', 'woody', 'soft spicy']",['Jean-Claude Ellena'],"Bvlgari Eau Parfumee au The Vert ExtremebyBvlgariis a Citrus Aromatic fragrance for women and men.Bvlgari Eau Parfumee au The Vert Extremewas launched in 1996. The nose behind this fragrance is Jean-Claude Ellena. Top notes are Bergamot, Coriander, Pepper, Orange and Orange Blossom; middle notes are Cardamom, Jasmine and Bulgarian Rose; base notes are Green Tea and Woody Notes."
Eau Parfumee au The Blanc Bvlgarifor women and men,for women and men,4.18,"2,251","['fresh spicy', 'musky', 'citrus', 'green', 'aromatic', 'white floral', 'herbal', 'warm spicy', 'fresh', 'powdery']",['Jacques Cavallier'],"Eau Parfumee au The BlancbyBvlgariis a Floral Woody Musk fragrance for women and men.Eau Parfumee au The Blancwas launched in 2003. The nose behind this fragrance is Jacques Cavallier. Top notes are Tea, Artemisia, Bergamot, Orange Blossom and Bitter Orange; middle notes are Pepper, Cardamom and Coriander; base notes are Musk, Woody Notes, Jasmine, Amber and Rose."
Eau Parfumee au The Bleu Bvlgarifor women and men,for women and men,4.11,880,"['powdery', 'violet', 'green', 'iris', 'lavender', 'aromatic', 'fresh spicy', 'floral', 'fresh', 'earthy']",['Daniela (Roche) Andrier'],Eau Parfumee au The BleubyBvlgariis a Aromatic fragrance for women and men.Eau Parfumee au The Bleuwas launched in 2015. The nose behind this fragrance is Daniela (Roche) Andrier. Top notes are Lavender and Shiso; middle notes are Tea and Violet; base notes are Iris and Musk.
Eau Parfumee au The Noir Bvlgarifor women and men,for women and men,4.15,685,"['leather', 'tobacco', 'rose', 'woody', 'oud', 'green', 'animalic', 'sweet', 'patchouli', 'fresh']",['Jacques Cavallier'],Eau Parfumee au The NoirbyBvlgariis a Amber Woody fragrance for women and men.Eau Parfumee au The Noirwas launched in 2015. The nose behind this fragrance is Jacques Cavallier.
Eau Parfumee au The Rouge Bvlgarifor women and men,for women and men,4.09,"2,264","['green', 'woody', 'citrus', 'sweet', 'fruity', 'nutty', 'musky', 'soft spicy', 'fresh', 'fresh spicy']",['Olivier Polge'],"Eau Parfumee au The RougebyBvlgariis a Amber Woody fragrance for women and men.Eau Parfumee au The Rougewas launched in 2006. The nose behind this fragrance is Olivier Polge. Top notes are Pink Pepper, Bergamot and Orange; middle notes are Tea and Fig; base notes are Walnut, Resin and Musk."
Eau Parfumee au The Vert Bvlgarifor women and men,for women and men,4.02,"2,131","['citrus', 'aromatic', 'white floral', 'green', 'woody', 'warm spicy', 'fresh', 'fresh spicy', 'powdery', 'musky']",['Jean-Claude Ellena'],"Eau Parfumee au The VertbyBvlgariis a Citrus Aromatic fragrance for women and men.Eau Parfumee au The Vertwas launched in 1992. The nose behind this fragrance is Jean-Claude Ellena. Top notes are Bergamot, Cardamom, Lemon, Coriander, Orange Blossom and Mandarin Orange; middle notes are Jasmine, Lily-of-the-Valley and Bulgarian Rose; base notes are Green Tea, Musk, Cedar, Precious Woods, Sandalwood and Amber."
Bvlgari Man Bvlgarifor men,for men,4,"2,319","['woody', 'ozonic', 'amber', 'aquatic', 'aromatic', 'honey', 'floral', 'earthy', 'musky', 'sweet']",['Alberto Morillas'],"Bvlgari ManbyBvlgariis a Amber Woody fragrance for men.Bvlgari Manwas launched in 2010. The nose behind this fragrance is Alberto Morillas. Top notes are Violet Leaf, Lotus, Bergamot and White Pear; middle notes are Vetyver, Woodsy Notes, Cashmere Wood, Sandalwood, Amber and Cypriol Oil or Nagarmotha; base notes are White Honey, Musk, Benzoin and Tonka Bean."
Bvlgari Man Black Orient Bvlgarifor men,for men,4.45,873,"['leather', 'oud', 'warm spicy', 'rum', 'animalic', 'rose', 'tuberose', 'aromatic', 'smoky', 'white floral']",['Alberto Morillas'],Bvlgari Man Black OrientbyBvlgariis a Amber Woody fragrance for men.Bvlgari Man Black Orientwas launched in 2016. The nose behind this fragrance is Alberto Morillas. Top notes are Rum and Cardamom; middle notes are Taif Rose and Tuberose; base notes are Leather and Agarwood (Oud).
Bvlgari Man Extreme Bvlgarifor men,for men,4.16,"1,841","['citrus', 'aromatic', 'woody', 'green', 'fresh spicy', 'warm spicy', 'amber', 'floral', 'earthy']",['Alberto Morillas'],"Bvlgari Man ExtremebyBvlgariis a Woody Aromatic fragrance for men.Bvlgari Man Extremewas launched in 2013. The nose behind this fragrance is Alberto Morillas. Top notes are Cactus Juice, Calabrian bergamot and Pink Grapefruit; middle notes are Guatemalan Cardamom, Freesia and Amber; base notes are Haitian Vetiver, Woodsy Notes and Benzoin."
Bvlgari Man Glacial Essence Bvlgarifor men,for men,3.73,980,"['woody', 'aromatic', 'fresh spicy', 'powdery', 'musky', 'warm spicy', 'herbal']",['Alberto Morillas'],"Bvlgari Man Glacial EssencebyBvlgariis a Aromatic Fougere fragrance for men.Bvlgari Man Glacial Essencewas launched in 2020. The nose behind this fragrance is Alberto Morillas. Top notes are Juniper Berries, Ginger and Geranium; middle notes are Sandalwood, Orris Root and Artemisia; base notes are Clearwood, Musk and Cedar."
Bvlgari Man In Black Bvlgarifor men,for men,4.32,"8,172","['warm spicy', 'woody', 'leather', 'rum', 'amber', 'sweet', 'tobacco', 'vanilla', 'animalic', 'iris']",['Alberto Morillas'],"Bvlgari Man In BlackbyBvlgariis a Amber Floral fragrance for men.Bvlgari Man In Blackwas launched in 2014. The nose behind this fragrance is Alberto Morillas. Top notes are Spices, Rum and Tobacco; middle notes are Leather, Iris and Tuberose; base notes are Tonka Bean, Guaiac Wood and Benzoin."
Bvlgari Man In Black Essence Bvlgarifor men,for men,4.41,330,"['warm spicy', 'amber', 'woody', 'rum', 'floral', 'musky']",['Alberto Morillas'],"Bvlgari Man In Black EssencebyBvlgariis a Amber Spicy fragrance for men.Bvlgari Man In Black Essencewas launched in 2017. The nose behind this fragrance is Alberto Morillas. Top notes are Spices and Rum; middle notes are Flowers and Musk; base notes are Oriental notes, Resin and Guaiac Wood."
Bvlgari Man Rain Essence Bvlgarifor men,for men,3.89,584,"['musky', 'floral', 'citrus', 'powdery', 'ozonic', 'green', 'woody', 'aquatic', 'amber', 'sweet']",['Alberto Morillas'],Bvlgari Man Rain EssencebyBvlgariis a Floral Woody Musk fragrance for men. This is a new fragrance.Bvlgari Man Rain Essencewas launched in 2023. The nose behind this fragrance is Alberto Morillas. Top notes are Green Tea and Orange; middle notes are White Lotus and Musk; base notes are Guaiac Wood and Amber.
Bvlgari Man Terrae Essence Bvlgarifor men,for men,3.83,"1,204","['earthy', 'citrus', 'woody', 'amber', 'aromatic', 'iris']",['Alberto Morillas'],Bvlgari Man Terrae EssencebyBvlgariis a Woody fragrance for men.Bvlgari Man Terrae Essencewas launched in 2021. The nose behind this fragrance is Alberto Morillas. Top notes are Citron and Calamansi; middle notes are Vetiver and Orris; base notes are Earthy Notes and Styrax.
Bvlgari Man The Silver Limited Edition Bvlgarifor men,for men,4.03,71,"['woody', 'amber', 'earthy', 'honey', 'aromatic', 'musky', 'floral', 'powdery', 'citrus']",['Alberto Morillas'],"Bvlgari Man The Silver Limited EditionbyBvlgariis a Amber Woody fragrance for men.Bvlgari Man The Silver Limited Editionwas launched in 2011. The nose behind this fragrance is Alberto Morillas. Top notes are Bergamot, Lotus and Violet Leaf; middle notes are Vetiver, Woodsy Notes, Cypriol Oil or Nagarmotha and Sandalwood; base notes are White Honey, Cashmere Wood, Amber, Benzoin and Musk."
Bvlgari Man Wood Essence Bvlgarifor men,for men,3.87,"2,157","['woody', 'aromatic', 'citrus', 'amber', 'fresh spicy']",['Alberto Morillas'],"Bvlgari Man Wood EssencebyBvlgariis a Woody fragrance for men.Bvlgari Man Wood Essencewas launched in 2018. The nose behind this fragrance is Alberto Morillas. Top notes are citruses with sugar, Lemon Zest and Coriander Leaf; middle notes are Cypress, Cedar and Vetiver; base note is Benzoin."
Bvlgari Man Wood Neroli Bvlgarifor men,for men,4.12,"1,700","['citrus', 'white floral', 'woody', 'fresh spicy', 'amber', 'animalic', 'aromatic', 'musky', 'powdery', 'fresh']",['Alberto Morillas'],"Bvlgari Man Wood NerolibyBvlgariis a Woody Floral Musk fragrance for men.Bvlgari Man Wood Neroliwas launched in 2019. The nose behind this fragrance is Alberto Morillas. Top notes are Neroli and Bergamot; middle notes are Orange Blossom, Virginia Cedar and Cypriol Oil or Nagarmotha; base notes are Woody Notes, White Musk, Ambergris, Amber and Leather."
Man Black Cologne Bvlgarifor men,for men,4.16,703,"['amber', 'white floral', 'citrus', 'woody', 'green', 'rum', 'tuberose', 'warm spicy', 'powdery', 'animalic']",['Alberto Morillas'],"Man Black ColognebyBvlgariis a Amber Floral fragrance for men.Man Black Colognewas launched in 2016. The nose behind this fragrance is Alberto Morillas. Top notes are Rum, Citruses and Green Notes; middle notes are Orange Blossom and Tuberose; base notes are Amber, Benzoin, Sandalwood and Musk."
Bvlgari Man In Black Parfum Bvlgarifor men,for men,3.97,156,"['warm spicy', 'woody', 'amber', 'tuberose', 'iris', 'aromatic', 'balsamic', 'white floral', 'powdery', 'vanilla']",['Alberto Morillas'],Bvlgari Man In Black ParfumbyBvlgariis a Amber Woody fragrance for men. This is a new fragrance.Bvlgari Man In Black Parfumwas launched in 2024. The nose behind this fragrance is Alberto Morillas. Top notes are Spices and elemi; middle notes are Tuberose and Iris; base notes are Siam Benzoin and dark woodsy notes.
L'Opera Grandiosa Bvlgarifor women and men,for women and men,5,2,"['rose', 'musky', 'floral', 'powdery']",['Daniela (Roche) Andrier'],L'Opera GrandiosabyBvlgariis a Floral fragrance for women and men.L'Opera Grandiosawas launched in 2021. The nose behind this fragrance is Daniela (Roche) Andrier.
Murano Amarena Bvlgarifor women,for women,4.38,8,"['cherry', 'tuberose', 'rose', 'woody', 'white floral', 'fruity', 'powdery', 'sweet', 'fresh spicy', 'sour']",['Daniela (Roche) Andrier'],"Murano AmarenabyBvlgariis a Floral Fruity fragrance for women.Murano Amarenawas launched in 2018. The nose behind this fragrance is Daniela (Roche) Andrier. Top notes are Pomegranate, Cherry and Tuberose; middle note is Rose; base note is Powdery Notes."
Murano Calaluna Bvlgarifor women,for women,4.09,11,"['powdery', 'warm spicy', 'lactonic', 'woody', 'iris', 'floral', 'aromatic', 'fruity', 'vanilla', 'musky']",['Daniela (Roche) Andrier'],Murano CalalunabyBvlgariis a Woody Spicy fragrance for women.Murano Calalunawas launched in 2018. The nose behind this fragrance is Daniela (Roche) Andrier.
Murano Lazulia Bvlgarifor women,for women,4.75,4,"['amber', 'white floral', 'smoky', 'balsamic', 'oud', 'animalic', 'warm spicy']",['Daniela (Roche) Andrier'],Murano LazuliabyBvlgariis a Amber Floral fragrance for women.Murano Lazuliawas launched in 2018. The nose behind this fragrance is Daniela (Roche) Andrier. Top note is Jasmine; middle note is Incense; base notes are Ambergris and Agarwood (Oud).
Murano Noorah Bvlgarifor women,for women,3.67,6,"['warm spicy', 'sweet', 'woody', 'honey', 'vanilla', 'aromatic', 'cinnamon', 'tobacco', 'amber', 'patchouli']",['Daniela (Roche) Andrier'],Murano NoorahbyBvlgariis a Chypre Floral fragrance for women.Murano Noorahwas launched in 2018. The nose behind this fragrance is Daniela (Roche) Andrier.
Murano Selima Bvlgarifor women,for women,4.71,7,"['warm spicy', 'sweet', 'rose', 'earthy', 'fruity', 'woody', 'metallic', 'leather', 'floral']",['Daniela (Roche) Andrier'],Murano SelimabyBvlgariis a Amber Spicy fragrance for women.Murano Selimawas launched in 2018. The nose behind this fragrance is Daniela (Roche) Andrier.
Murano Zahira Bvlgarifor women,for women,2.67,3,"['warm spicy', 'yellow floral', 'woody', 'cinnamon', 'amber', 'sweet', 'powdery']",['Daniela (Roche) Andrier'],Murano ZahirabyBvlgariis a Amber Floral fragrance for women.Murano Zahirawas launched in 2018. The nose behind this fragrance is Daniela (Roche) Andrier. Top note is Cinnamon; middle note is Ylang-Ylang; base notes are Benzoin and Sandalwood.
Goldea Bvlgarifor women,for women,3.78,"1,538","['sweet', 'white floral', 'woody', 'yellow floral', 'amber', 'musky', 'fruity', 'patchouli', 'powdery', 'citrus']",['Alberto Morillas'],"GoldeabyBvlgariis a Amber Floral fragrance for women.Goldeawas launched in 2015. The nose behind this fragrance is Alberto Morillas. Top notes are Musk, Raspberry, Orange Blossom and Bergamot; middle notes are Ylang-Ylang, Musk and Jasmine; base notes are Amber, Musk, Patchouli and Papyrus."
Goldea The Roman Night Bvlgarifor women,for women,3.86,"1,301","['white floral', 'fruity', 'musky', 'woody', 'floral', 'rose', 'earthy', 'fresh spicy', 'fresh', 'patchouli']",['Alberto Morillas'],"Goldea The Roman NightbyBvlgariis a Chypre Floral fragrance for women.Goldea The Roman Nightwas launched in 2017. The nose behind this fragrance is Alberto Morillas. Top notes are mulberry, Black Pepper and Bergamot; middle notes are Night Blooming Jasmine, Peony, Tuberose and Rose; base notes are Black Musk, Patchouli, Vetiver and Moss."
Goldea The Roman Night Absolute Bvlgarifor women,for women,3.84,492,"['white floral', 'fruity', 'sweet', 'vanilla', 'patchouli', 'musky', 'earthy', 'powdery', 'woody', 'mossy']",['Alberto Morillas'],"Goldea The Roman Night AbsolutebyBvlgariis a Chypre Floral fragrance for women.Goldea The Roman Night Absolutewas launched in 2018. The nose behind this fragrance is Alberto Morillas. Top notes are Plum and Orange Blossom; middle notes are Madagascar Vanilla and Jasmine Sambac; base notes are Patchouli, Black Musk and Moss."
Rose Goldea Bvlgarifor women,for women,3.94,"1,618","['rose', 'floral', 'woody', 'musky', 'fresh', 'powdery', 'fresh spicy', 'white floral']",['Alberto Morillas'],"Rose GoldeabyBvlgariis a Floral Woody Musk fragrance for women.Rose Goldeawas launched in 2016. The nose behind this fragrance is Alberto Morillas. Top notes are Rose, Musk, Pomegranate and Bergamot; middle notes are Damask Rose, Peony, Jasmine and Peach; base notes are Musk, Sandalwood, Olibanum and Vanilla."
Rose Goldea Blossom Delight Bvlgarifor women,for women,3.91,535,"['rose', 'green', 'musky', 'white floral', 'floral', 'tropical', 'powdery', 'fresh', 'ozonic']",['Alberto Morillas'],"Rose Goldea Blossom DelightbyBvlgariis a Floral fragrance for women.Rose Goldea Blossom Delightwas launched in 2019. The nose behind this fragrance is Alberto Morillas. Top notes are Papaya, Violet Leaf and Jasmine; middle notes are Rose, Rose Leaf and Lily-of-the-Valley; base notes are Bulgarian Rose, White Musk and Amber."
Rose Goldea Jacky Tsai Edition Bvlgarifor women,for women,4.42,19,"['rose', 'woody', 'floral', 'powdery', 'musky', 'fresh spicy', 'fruity', 'fresh', 'vanilla', 'white floral']",['Alberto Morillas'],"Rose Goldea Jacky Tsai EditionbyBvlgariis a Floral Woody Musk fragrance for women.Rose Goldea Jacky Tsai Editionwas launched in 2018. The nose behind this fragrance is Alberto Morillas. Top notes are Rose, Pomegranate, Musk and Bergamot; middle notes are Damask Rose, Peony, Jasmine and Peach; base notes are Musk, Vanilla, Sandalwood and Olibanum."
Rose Goldea Kathleen Kye Edition Bvlgarifor women,for women,4.44,9,"['rose', 'floral', 'citrus', 'fresh spicy', 'woody', 'powdery', 'musky', 'fresh', 'vanilla', 'white floral']",['Alberto Morillas'],"Rose Goldea Kathleen Kye EditionbyBvlgariis a Floral Woody Musk fragrance for women.Rose Goldea Kathleen Kye Editionwas launched in 2021. The nose behind this fragrance is Alberto Morillas. Top notes are Rose, Bergamot, Musk and Pomegranate; middle notes are Damask Rose, Peony, Jasmine and Peach; base notes are Musk, Vanilla, Sandalwood and Olibanum."
Amarena Bvlgarifor women,for women,4.02,123,"['cherry', 'rose', 'tuberose', 'powdery', 'sweet', 'white floral', 'fruity', 'woody', 'floral', 'fresh spicy']",['Daniela (Roche) Andrier'],"AmarenabyBvlgariis a Floral fragrance for women.Amarenawas launched in 2014. The nose behind this fragrance is Daniela (Roche) Andrier. Top notes are Cherry, Tuberose and Pomegranate; middle note is Rose; base note is Powdery Notes."
Ashlemah Bvlgarifor women,for women,4.25,161,"['powdery', 'violet', 'lavender', 'floral', 'vanilla', 'almond', 'aromatic', 'fresh spicy']",['Daniela (Roche) Andrier'],AshlemahbyBvlgariis a Floral fragrance for women.Ashlemahwas launched in 2014. The nose behind this fragrance is Daniela (Roche) Andrier.
Astrea Bvlgarifor women,for women,4.61,38,"['white floral', 'leather', 'warm spicy', 'honey', 'floral', 'metallic', 'sweet', 'musky', 'tobacco', 'powdery']",['Alberto Morillas'],AstreabyBvlgariis a Amber Floral fragrance for women.Astreawas launched in 2021. The nose behind this fragrance is Alberto Morillas. Top note is Saffron; middle note is Jasmine Sambac; base notes are Honey and Suede.
Calaluna Bvlgarifor women,for women,4.15,157,"['powdery', 'lactonic', 'warm spicy', 'iris', 'woody', 'floral', 'aromatic', 'musky', 'violet', 'vanilla']",['Daniela (Roche) Andrier'],CalalunabyBvlgariis a Woody Spicy fragrance for women.Calalunawas launched in 2014. The nose behind this fragrance is Daniela (Roche) Andrier.
Coralia Bvlgarifor women,for women,3.74,38,"['floral', 'animalic', 'soft spicy', 'fruity', 'leather', 'musky', 'iris', 'powdery', 'amber', 'citrus']",['Sophie Labbé'],"CoraliabyBvlgariis a Amber Floral fragrance for women.Coraliawas launched in 2019. The nose behind this fragrance is Sophie Labbe. Top notes are Pink Pepper and Mandarin Orange; middle notes are Osmanthus, Leather and Orris; base notes are Ambergris and Musk."
